{
  "rule_id": "BAZI-TIMING-ACTIVATION-001",
  "title": "Emit structural natal-to-year and natal-to-month branch activations",
  "system": "bazi",
  "lineage": "ziping-calculation-baseline",
  "version": "0.2.0",
  "status": "tested",
  "kind": "calculation",
  "conditions": [
    {
      "fact_path": "period_pillars",
      "operator": "exists"
    }
  ],
  "conclusions": [
    {
      "finding_type": "bazi.timing_activation",
      "output_path": "activations",
      "value": "branch_relation_facts",
      "confidence": "deterministic"
    }
  ],
  "priority": 940,
  "sources": [
    {
      "source_id": "SRC-BAZI-PROJECT-SPEC-001",
      "locator": "systems/bazi/timing.py",
      "support_type": "direct"
    }
  ],
  "tests": [
    "CASE-BAZI-STANDARD-004"
  ]
}
