{
  "conclusions": [
    {
      "confidence": "deterministic",
      "finding_type": "bazi.calculation",
      "output_path": "computed_facts.pillars.day",
      "value": "zi_initial_boundary"
    }
  ],
  "conditions": [
    {
      "fact_path": "normalized_input.day_boundary",
      "operator": "eq",
      "value": "zi_initial"
    }
  ],
  "disputes": [
    "DSP-BAZI-DAY-BOUNDARY-001"
  ],
  "kind": "calculation",
  "lineage": "late-zi-alternative",
  "priority": 800,
  "rule_id": "BAZI-CAL-DAY-002",
  "sources": [
    {
      "locator": "Pinned v1.4.8 public API and implementation",
      "source_id": "SRC-BAZI-LUNARPY-001",
      "support_type": "direct"
    }
  ],
  "status": "tested",
  "system": "bazi",
  "tests": [
    "CASE-BAZI-EDGE-LATEZI-ZIINITIAL-001"
  ],
  "title": "Advance the day pillar at 23:00 when zi_initial is selected",
  "version": "0.1.0"
}
