{
  "conclusions": [
    {
      "confidence": "deterministic",
      "finding_type": "bazi.calculation",
      "output_path": "normalized_input.local_datetime",
      "value": "civil_time"
    }
  ],
  "conditions": [
    {
      "fact_path": "normalized_input.true_solar_time_applied",
      "operator": "eq",
      "value": false
    }
  ],
  "disputes": [
    "DSP-BAZI-SOLAR-TIME-001"
  ],
  "kind": "calculation",
  "lineage": "ziping-calculation-baseline",
  "priority": 800,
  "rule_id": "BAZI-TIME-CIVIL-001",
  "sources": [
    {
      "locator": "ZoneInfo fold and transition behavior",
      "source_id": "SRC-TIME-PYTHON-ZONEINFO-001",
      "support_type": "direct"
    },
    {
      "locator": "Pinned v1.4.8 public API and implementation",
      "source_id": "SRC-BAZI-LUNARPY-001",
      "support_type": "direct"
    }
  ],
  "status": "tested",
  "system": "bazi",
  "tests": [
    "CASE-BAZI-STANDARD-001",
    "CASE-BAZI-DISPUTE-SOLAR-TIME-001"
  ],
  "title": "Use IANA local civil time without solar-time correction",
  "version": "0.1.0"
}
