{
  "rule_id": "ZIWEI-NATIVE-NATAL-001",
  "title": "Calculate the project-native Ziwei structural foundation",
  "system": "ziwei",
  "lineage": "project-native-ziwei-structural-v0.4",
  "version": "0.4.0",
  "status": "tested",
  "kind": "calculation",
  "conditions": [{ "fact_path": "normalized_input.time_index", "operator": "exists" }],
  "conclusions": [{ "finding_type": "ziwei.natal", "output_path": "computed_facts.palaces", "value": "project_native_foundation", "confidence": "medium" }],
  "priority": 1000,
  "sources": [
    { "source_id": "SRC-ZIWEI-PROJECT-SPEC-001", "locator": "systems/ziwei/LINEAGE.md", "support_type": "direct" },
    { "source_id": "SRC-ZIWEI-QUANSHU-001", "locator": "palace and major-star formula sections", "support_type": "corroborating" }
  ],
  "tests": ["CASE-ZIWEI-NATAL-001", "CASE-ZIWEI-NATAL-002"]
}
