{
  "rule_id": "VEDIC-JAIMINI-KARAKA-SEVEN-001",
  "title": "Rank seven chara karakas without Rahu",
  "system": "vedic-astrology",
  "lineage": "jaimini-seven-karaka-v0.1",
  "version": "0.1.0",
  "status": "tested",
  "kind": "calculation",
  "conditions": [{"fact_path": "normalized_input.jaimini_karaka_policy", "operator": "eq", "value": "seven"}],
  "conclusions": [{"finding_type": "vedic.jaimini.karaka", "output_path": "computed_facts.lineages.jaimini.chara_karakas", "value": "seven_planets_descending_degree", "confidence": "deterministic"}],
  "priority": 820,
  "sources": [
    {"source_id": "SRC-VEDIC-JAIMINI-RAO-1949-001", "locator": "Bibliographic Jaimini commentary record", "support_type": "corroborating"},
    {"source_id": "SRC-VEDIC-PROJECT-SPEC-001", "locator": "Seven-karaka software policy", "support_type": "direct"}
  ],
  "disputes": ["DSP-VEDIC-JAIMINI-KARAKA-001"],
  "tests": ["CASE-VEDIC-NATAL-001", "CASE-VEDIC-DISPUTE-KARAKA-001"]
}
